{
  "acoustic_accuracy_measured": false,
  "conclusion": "仅按文本和时间戳进行质量代理评估，A在中文可读性、核心声乐术语、局部内容保留和重叠控制上整体优于B，因此选择A（60.6分，高于B的55.0分）。B虽有更完整的长句和少数A缺失的歌曲片段，但无关字幕、系统性同音替换、长重叠及疑似大段漏转更频繁。没有原音频或人工真值，无法测量声学准确率，也不能确认两份文本共同犯下的错误；这些分数不是CER或WER。",
  "confidence": "medium",
  "limitations": [
    "未提供原音频或人工参考文本，所有判断均为文本质量代理，不能确认发音、方言、歌唱内容或两系统共有错误。",
    "歌曲、发声示范、用户名和直播评论具有较强歧义，部分看似异常的词也可能来自实际口语或背景播放。",
    "两份输出均存在重叠、倒序和不同粒度的分段；静音、漏转与增写只能通过相互对照和长上下文间接推断。"
  ],
  "metric_name": "codex_text_only_quality_proxy",
  "pairwise_findings": [
    {
      "assessment": "B更流畅，且与后续持续调整直播灯光的上下文一致；此处B更可信。",
      "start_ms": 0,
      "system_a_text": "哇 这也太死掉了吧",
      "system_b_text": "哇 这个光 这也很nice"
    },
    {
      "assessment": "A能接续呼吸动作说明，B出现无意义词串，A明显更好。",
      "start_ms": 692540,
      "system_a_text": "没气了慢慢收",
      "system_b_text": "开上网位煤气的慢慢收"
    },
    {
      "assessment": "后续两边都讨论“小腹往里、大腹往外”，A术语正确且一致。",
      "start_ms": 796560,
      "system_a_text": "这叫大腹",
      "system_b_text": "这叫大富"
    },
    {
      "assessment": "A更接近硬腭这一解剖术语；B随后还产生“硬饿/软饿”，术语质量较差。",
      "start_ms": 997460,
      "system_a_text": "舔到这个牙齿后面叫做硬颚",
      "system_b_text": "我们在张开嘴巴的时候你会舔到这个牙齿后面叫做硬个"
    },
    {
      "assessment": "上下文持续讲美声唱法，因此该处B优于A。",
      "start_ms": 1160060,
      "system_a_text": "美中唱法是这样子的",
      "system_b_text": "美声唱法是这样子的"
    },
    {
      "assessment": "在区分气混和漏气的语境中，A的“不漏”和“声带闭合”均更连贯。",
      "start_ms": 1678300,
      "system_a_text": "我其他我都不漏 / 我有能力去控制我的声带闭合",
      "system_b_text": "我其他我都补了我闭合很好我有能力去控制我的生态闭合"
    },
    {
      "assessment": "A插入与声乐教学无关的节目水印；B虽为空白，但没有同类污染，文本可靠性上B更好。",
      "start_ms": 2381600,
      "system_a_text": "优优独播剧场——YoYo Television Series Exclusive",
      "system_b_text": ""
    },
    {
      "assessment": "B用极短文本覆盖约30秒，而A保留多轮相关讲解；仅按完整性代理，A明显占优。",
      "start_ms": 2582668,
      "system_a_text": "直接学验音坑死人了 / 声带边缘化不算验音 / 验音是压缩技能",
      "system_b_text": "你看一下啊"
    },
    {
      "assessment": "B的重叠候选自相矛盾；A与后续“45分钟到60分钟”一致。",
      "start_ms": 3230252,
      "system_a_text": "就是45分钟正课",
      "system_b_text": "就是45分钟正课 / 15分钟正课"
    },
    {
      "assessment": "A符合地区性鼻音的整段主题，B后半句不成义。",
      "start_ms": 4222852,
      "system_a_text": "东北三省 / 十个人里面有九个半有鼻音",
      "system_b_text": "东北三省十个人里面有九个败路"
    },
    {
      "assessment": "上下文随后反复提到声音到头腔，A的术语正确且连贯。",
      "start_ms": 4375620,
      "system_a_text": "走的是我们头腔共鸣",
      "system_b_text": "走的是我们投枪共鸣"
    },
    {
      "assessment": "前一句刚讨论鼻炎与鼻音，A保持话题连续，B发生明显同音误识别。",
      "start_ms": 6280720,
      "system_a_text": "鼻炎跟这也没关系",
      "system_b_text": "明年跟这没关系啊"
    }
  ],
  "preferred_system": "a",
  "schema_version": "1",
  "system_a": {
    "chinese_fluency": 6.3,
    "completeness_proxy": 6.9,
    "contextual_coherence": 6.5,
    "quality_score": 60.6,
    "strengths": [
      "约530000ms后的主体教学和连麦轮次大多可以恢复，短分段相对便于阅读。",
      "“气息支撑”“腰腹支撑”“头腔共鸣”“真假声转换”等核心术语在较多关键位置得到正确保留。",
      "约2582668ms附近保留了B明显压缩掉的连续讲解，文本完整性代理较好。"
    ],
    "suspected_errors": [
      {
        "reason": "对齐处处于歌曲片段，B和长上下文均不涉及“明镜与点点栏目”，疑似无关模板文本插入。",
        "start_ms": 85000,
        "text": "请不吝点赞 订阅 转发 打赏支持明镜与点点栏目"
      },
      {
        "reason": "与171980ms的“欢迎下来”形成嵌套近重复，且后一个片段结束时间反而更早，属于明显的时间轴重复。",
        "start_ms": 171960,
        "text": "欢迎下来朋友"
      },
      {
        "reason": "B为“什么时候七夕”，后文紧接“下周几”“下周吗”，共同支持“气息”更可能是“七夕”的同音误识别。",
        "start_ms": 172660,
        "text": "我在看什么时候气息"
      },
      {
        "reason": "被完整包含在593640ms开始的“吸到哪里？吸到小腹，吸到丹田”中，随后又重复“吸到丹田”，形成重叠解码。",
        "start_ms": 595380,
        "text": "吸到小腹"
      },
      {
        "reason": "B为“美声唱法是这样子的”，前后也一直对比美声与流行唱法，因此“美中”更可能错误。",
        "start_ms": 1160060,
        "text": "美中唱法是这样子的"
      },
      {
        "reason": "B在相邻位置识别为“我从来没想过所以爱错”，A后续歌曲片段也出现“我从来没想过”，支持“笑过”更可能错误。",
        "start_ms": 1221080,
        "text": "我从来没笑过"
      },
      {
        "reason": "B在同一分类讲解中为“强混”，上下文持续讨论强混、弱混、平衡混和气混，术语被误写。",
        "start_ms": 1499460,
        "text": "第一个是什么 强魂"
      },
      {
        "reason": "相邻A片段随即给出“假声”，B的上下文也明确说第三步学习假声，疑似重叠候选误识别。",
        "start_ms": 2040840,
        "text": "加分"
      },
      {
        "reason": "前后均为声乐教学，B相同时间附近没有这类节目水印，疑似无关模板或字幕幻觉。",
        "start_ms": 2381600,
        "text": "优优独播剧场——YoYo Television Series Exclusive"
      },
      {
        "reason": "该片段与“线下的话是以美声为主”重叠，B也保留后者；当前文本语义无关，疑似重叠解码污染。",
        "start_ms": 2637800,
        "text": "线下的话是一杯美人生美酒"
      },
      {
        "reason": "B相近位置为“蛮长时间了”，上下文是说听众已在直播间停留较久，A文本不成义。",
        "start_ms": 4920880,
        "text": "埋场时间了"
      },
      {
        "reason": "B为“你现在就是每天走下坡路”，后者符合语法及年龄、机能下降的上下文。",
        "start_ms": 6315700,
        "text": "你现在就是每天狗下坡路"
      }
    ],
    "terminology_consistency": 5.6,
    "timestamp_continuity": 5.0
  },
  "system_b": {
    "chinese_fluency": 5.8,
    "completeness_proxy": 6.4,
    "contextual_coherence": 6.0,
    "quality_score": 55.0,
    "strengths": [
      "长段合并在部分教学内容中保留了较完整的因果链，例如吸气、呼气和腹部支撑的说明。",
      "约6005740ms后的歌曲示范保留了一段A未转出的副歌，局部完整性优于A。",
      "覆盖到源时长末端，直播结束语得到保留。"
    ],
    "suspected_errors": [
      {
        "reason": "对齐处为歌曲内容，A也在转写歌词；该字幕署名与直播上下文无关，并在B中多次重复出现，疑似模板污染。",
        "start_ms": 82770,
        "text": "中文字幕:Xia"
      },
      {
        "reason": "与171200ms开始的更长片段近乎完全重复，二者高度重叠且短片段先结束，破坏时间轴连续性。",
        "start_ms": 171220,
        "text": "游七夕 欢迎下来朋友 我在看什么时候七夕"
      },
      {
        "reason": "A对齐为“开始往外”“没气了慢慢收”，且上下文正在讲呼吸动作；B文本明显不成义。",
        "start_ms": 692540,
        "text": "开上网位煤气的慢慢收"
      },
      {
        "reason": "A为“这叫大腹”，B后文也使用“大腹是往外的”，因此此处“富”更可能是术语误识别。",
        "start_ms": 797130,
        "text": "这叫大富"
      },
      {
        "reason": "A识别为“硬颚”，后文继续对比硬腭、软腭；B的“硬个”以及后续“硬饿/软饿”破坏解剖术语。",
        "start_ms": 997460,
        "text": "我们在张开嘴巴的时候你会舔到这个牙齿后面叫做硬个"
      },
      {
        "reason": "A和长上下文都在讨论声带健康及声带闭合，B连续把“声带”识别成“生态”。",
        "start_ms": 1465100,
        "text": "在健康的生态的时候你生态你唱假声虚"
      },
      {
        "reason": "A为“其他我都不漏”“声带闭合”，符合气混与漏气的对比；B同时误识别了“不漏”和“声带”。",
        "start_ms": 1678300,
        "text": "气魂是你控制我就在这一句我就第一个字我其他我都补了我闭合很好我有能力去控制我的生态闭合这个是技巧"
      },
      {
        "reason": "该片段覆盖约30秒，但A在同一范围保留了咽音、声带边缘化和气息支撑的连续讨论；文本完整性代理显示B疑似大段漏转。",
        "start_ms": 2582668,
        "text": "你看一下啊"
      },
      {
        "reason": "B前一重叠片段和A均为“45分钟正课”，后文也反复说明45至60分钟，因此该重叠候选明显矛盾。",
        "start_ms": 3230252,
        "text": "15分钟正课"
      },
      {
        "reason": "A为“十个人里面有九个半有鼻音”，前后主题正是地区性鼻音；“九个败路”不成义。",
        "start_ms": 4222852,
        "text": "东北三省十个人里面有九个败路"
      },
      {
        "reason": "A为“头腔共鸣”，后文也继续说声音到头腔；“投枪共鸣”是明显术语误识别。",
        "start_ms": 4376490,
        "text": "走的是我们投枪共鸣"
      },
      {
        "reason": "A为“鼻炎跟这也没关系”，此前连麦者刚提到鼻炎，B的“明年”与上下文无关。",
        "start_ms": 6280720,
        "text": "明年跟这没关系啊"
      }
    ],
    "terminology_consistency": 4.9,
    "timestamp_continuity": 4.4
  }
}
